{
  "schema": "zaentrum.library.event/2",
  "eventId": "0bfaa763-dbac-510a-8a08-6f50f35bc7cc",
  "at": "2026-09-19T13:20:00Z",
  "by": "catalog example (originals are deleted after packaging)",
  "kind": "original-deleted",
  "versionId": "e3449b0b-2299-5203-b687-df793dd98241",
  "sourceId": "711a19f3-61aa-5d68-b4d3-7e9672694a15",
  "reason": "the package is the record once it is recorded",
  "accepted": []
}
